103;LUURZU - HEGO;2;Túmulo;Quinto Real;A 300 m al W del dolmen Luurzu - hego Hoja cartográfica Nº: 91-9;Urkiaga;NULL;623080;4668280;1120;42.1569812511546,-1.51019249702706;sábado, junio 21, 1975;Tomás López Sellés y Francisco Ondarra;"Túmulo de 9,5 m de ?, 1,5 m de alto al SE y 0,5 m al W, de tierra; no se distinguen cráter ni losas.";No se conoce.;A 320 m en dirección E desde el dolmen hay unas formaciones tumulares a 1025 msnm. En la misma línea , a 1 km se encuetra el túmulo de Luurzu - SE y el dolmen de Beotrin. Bibliografía: Revista Príncipe de Viana nº 144/145, año 1976.;NULL;Bloc 16: Artesiaga - Quinto Real.;NULL;NULL;NULL;NULL;NULL;NULL;NULL;NULL;NULL;NULL;NULL;NULL;NULL;NULL;NULL;NULL;NULL;NULL;NULL;NULL;NULL;NULL;NULL;NULL;NULL;NULL;NULL;NULL;NULL;NULL;NULL;NULL;NULL;NULL;NULL;NULL;NULL;NULL;NULL;NULL;NULL;NULL;NULL;NULL;NULL;NULL;NULL;NULL;NULL;NULL;NULL;NULL;NULL
104;LUURZU - HEGO-I;5;Crómlech;Quinto Real;A unos 450 m y a 340º se levanta Luurzu Gaina Hoja cartográfica Nº: 91-9;Urkiaga;NULL;622134;4668175;1060;42.1561839940733,-1.52166154574485;miércoles, junio 29, 1983;Francico Ondarra;"crómlech de 20 testigos de piedras areniscas, formando un círculo de 5,5 m de ?. Medidas de las mayores: 1.: (N) 0,25 m de alto; 0,9 m de largo; 0,1/0,23 m de grueso 2.: (S-SE) 0,9 m "" 3.: (S-SE) 0,25 m "" 0,7 m "" 0,25 m "" 4.: (S) 0,26 m "" 0,55 m "" 0,23 m "" En el exterior de la circunferencia hay más piedras que pudieron ser restos de alguna construcción ya destruída.";No se conoce.;Bibliografía: Educación y Cultura del Gobierno de Navarra. Arqueología nº 7 año 1988.;NULL;Bloc 16: Artesiaga - Quinto Real.;0104_DIB_126_0.jpg;NULL;NULL;NULL;NULL;NULL;NULL;NULL;NULL;NULL;NULL;NULL;NULL;NULL;NULL;NULL;NULL;NULL;NULL;NULL;NULL;NULL;NULL;NULL;NULL;NULL;NULL;NULL;NULL;NULL;NULL;NULL;NULL;NULL;NULL;NULL;NULL;NULL;NULL;NULL;NULL;NULL;NULL;NULL;NULL;NULL;NULL;NULL;NULL;NULL;NULL;NULL;NULL
105;LUURZU HEGO-II;5;Crómlech;Quinto Real;A 250 m por el N del dolmen. Hoja cartográfica Nº: 91-9;Urkiaga;NULL;622136;4668016;1060;42.1547521385615,-1.52167066900012;miércoles, junio 29, 1983;Francisco Ondarra;"Unos 20 testigos de piedra arenisca, formando un círculo de 4 m de ?. Los mayores son: - 1.: (N-NE) de 1 m de largo - 2.: (SE) 0,7 m "" - 3.: (S) 1,15 m "" - 4.: (W) 1,4 m de alto y de 1,15 m de perímetro a 1 m de altura. Las 1, 2 y 3 son gruesas y parecen estar tumbadas; la nº 4 está muy inclinada hacia el interior y es un monolito.";No se conoce.;Bibliografía: Revista Arqueología nº 7, editada por el Gobierno de Navarra en el año 1988.;NULL;Bloc 16: Artesiaga - Quinto Real.;0105_DIB_127_0.jpg;0105_DIB_127_1.jpg;NULL;NULL;NULL;NULL;NULL;NULL;NULL;NULL;NULL;NULL;NULL;NULL;NULL;NULL;NULL;NULL;NULL;NULL;NULL;NULL;NULL;NULL;NULL;NULL;NULL;NULL;NULL;NULL;NULL;NULL;NULL;NULL;NULL;NULL;NULL;NULL;NULL;NULL;NULL;NULL;NULL;NULL;NULL;NULL;NULL;NULL;NULL;NULL;NULL;NULL;NULL
106;LUURZU - IPAR;1;Dolmen;Baztan;A unos 250 m al W del crómlech de Argintzu-III Hoja cartográfica Nº: 91-9;Urkiaga;NULL;623310;4668880;1175;42.1623470831862,-1.50728241672655;domingo, abril 02, 1972;Francisco Ondarra;"Túmulo de 6 m de ? y 0,7 m de altura con cámara sepulcral de 1,4 m de larga y 1 m de ancha. Orientación 120º. Hay 3 losas de arenisca ""in situ"", más una cuarta, encima, la de cubierta. La losas N, S y la de cabecera están muy inclinadas, dando la impresión de que el conjunto se ha desplomado hacia el SW. La losa 1 (S) mide 0,7 m de alto; 1,6 m de largo y 0,15 m de grueso 2 (N) 0,9 1,6 0,15 3 0,5 1 0,05 3 partida verticalmente en dos trozos de cubierta de 1,7 m de largo 1 m de ancho 0,28";No se conoce.;Bibliografía: Revista Príncipe de Viana nº 142/143, año 1976.;NULL;Bloc 16: Artesiaga - Quinto Real.;0106_DIB_128_0.jpg;0106_DIB_128_1.jpg;NULL;NULL;NULL;NULL;NULL;NULL;NULL;NULL;NULL;NULL;NULL;NULL;NULL;NULL;NULL;NULL;NULL;NULL;NULL;NULL;NULL;NULL;NULL;NULL;NULL;NULL;NULL;NULL;NULL;NULL;NULL;NULL;NULL;NULL;NULL;NULL;NULL;NULL;NULL;NULL;NULL;NULL;NULL;NULL;NULL;NULL;NULL;NULL;NULL;NULL;NULL
107;LUURZU LEPOA-I;1;Dolmen;Quinto Real - Irurita;Al W de la peña de su nombre, en el collado. Hoja cartográfica Nº: 91-9;Urkiaga;NULL;623140;4668580;1175;42.1596728286925,-1.5094030707034;miércoles, mayo 22, 1957;Tomás López Sellés;"Túmulo de piedras de 11/12 m de ? y de 0,8 m de altura, con cráter cenrtral y cuatro losas sueltas de calizas del terreno: Losa nº 1 (N) de 0,5 m de alto; 1,7 m de largo; 0,15 m de grueso "" 2 (S) 1,3 m 1,7 m 0,28 ambas hincadas en tierra muy inclinadas hacia afuera Hay otros dos fragmentos: - nº 3: de 1,2 m de largo; 0,5 m de ancho y 0,25/0,3 m de grueso - nº 4: 1 1/0,8 0,2/ 0,25 El centro del galgal tiene un hoyo de 0,8 m de profundidad. La cámara podría haber tenido unos 0,8 m de ancho. Orientación a 100º.";No se conoce;El monumento se está utilizando como una palomera de caza. Catalogado en MUNIBE con el nº 71-13, suplemento nº 1, año 1973.;NULL;Bloc 16: Artesiaga - Quinto Real.;0107_FOT_129_0.jpg;NULL;NULL;NULL;NULL;NULL;NULL;NULL;NULL;NULL;NULL;NULL;NULL;NULL;NULL;NULL;NULL;NULL;NULL;NULL;NULL;NULL;NULL;NULL;NULL;NULL;NULL;NULL;NULL;NULL;NULL;NULL;NULL;NULL;NULL;NULL;NULL;NULL;NULL;NULL;NULL;NULL;NULL;NULL;NULL;NULL;NULL;NULL;NULL;NULL;NULL;NULL;NULL
108;LUURZU - SE;2;Túmulo;Quinto Real;A unos 700 m se alza la cumbre Luurzu a 320º. Hoja cartográfica Nº: 91-9;Túmulo de 9 m de;NULL;623650;4668190;995;42.1560811624,-1.50331437008876;miércoles, junio 29, 1983;Francisco Ondarra;Túmulo de 9 m de ? y de 0,8 m de altura, compuesto de piedras areniscas bastante grandes. Entre el musgo y el brezo se distingue en el centro un hoyo rebajado en el que no se ven losas.;No se conoce.;Bibliografía: Príncipe de Viana Arqueología nº 7, año 1988. En dirección al dolmen de Luurzu Hego, a unos 120 m W-WN, existe otra formación tumular, pendiente de tomar datos.;NULL;Bloc 16: Artesiaga - Quinto Real.;NULL;NULL;NULL;NULL;NULL;NULL;NULL;NULL;NULL;NULL;NULL;NULL;NULL;NULL;NULL;NULL;NULL;NULL;NULL;NULL;NULL;NULL;NULL;NULL;NULL;NULL;NULL;NULL;NULL;NULL;NULL;NULL;NULL;NULL;NULL;NULL;NULL;NULL;NULL;NULL;NULL;NULL;NULL;NULL;NULL;NULL;NULL;NULL;NULL;NULL;NULL;NULL;NULL
109;LUURZU-AITZ ZABALTOKI;13;Monolito;Quinto Real;A 10 m del túmulo y 40 m del dolmen. Hoja cartográfica Nº: 91-9;Urkiaga;NULL;623050;4668610;1160;42.1599570770652,-1.51048581877472;NULL;NULL;"De 2,50/5 m de largo; 0,5 m de ancho y 0,6/0,7 m de grueso; de arenisca roja; tendido en el suelo; orientación a 35º. La superficie del extremo o cara SW ha podido ser labrada.";NULL;Bibliografía: Revista Príncipe de Viana nº 142/143, año 1976.;NULL;Bloc 16: Artesiaga - Quinto Real.;0109_DIB_130_0.jpg;0109_FOT_131_1.jpg;0109_FOT_131_2.jpg;0109_FOT_131_3.jpg;0109_FOT_131_4.jpg;0109_FOT_131_5.jpg;0109_FOT_131_6.jpg;NULL;NULL;NULL;NULL;NULL;NULL;NULL;NULL;NULL;NULL;NULL;NULL;NULL;NULL;NULL;NULL;NULL;NULL;NULL;NULL;NULL;NULL;NULL;NULL;NULL;NULL;NULL;NULL;NULL;NULL;NULL;NULL;NULL;NULL;NULL;NULL;NULL;NULL;NULL;NULL;NULL;NULL;NULL;NULL;NULL;NULL
110;LUURZU I-II-III-IV;2;Túmulos;Quinto Real;Junto al dolmen de Luurzu, a unos 40 al E Hoja cartográfica Nº: 91-9;Urkiaga;NULL;623010;4668580;1170;42.1596932604737,-1.51097619235202;sábado, marzo 24, 1973;Francisco Ondarra. En esa fecha los nº I y II. El 2 de junio de 1983 los nº III y IV.;Túmulo: - nº I : de 5 m de ? y 0,4m de alto, de tierra y piedras areniscas - nº II, a 5 m del dolmen: de 3 m de ? y 0,2 m de altura, de tierra y piedras areniscas, recubierto de hierba - nº III, a 0,5 m del dolmen, a 20º: de 2,5 m de ? y 0,25 m de alto de tierra y piedras areniscas - nº IV, a 5,4 m de III por el S-SW: de 3 m de ? y 0,3 m de alto de tierra y piedras areniscas.;No se conoce;Bibliografía: Educación y Cultura del Gobierno de Navarra. Arqueología nº 7 año 1988.;NULL;Bloc 16: Artesiaga - Quinto Real.;0110_DIB_132_0.jpg;NULL;NULL;NULL;NULL;NULL;NULL;NULL;NULL;NULL;NULL;NULL;NULL;NULL;NULL;NULL;NULL;NULL;NULL;NULL;NULL;NULL;NULL;NULL;NULL;NULL;NULL;NULL;NULL;NULL;NULL;NULL;NULL;NULL;NULL;NULL;NULL;NULL;NULL;NULL;NULL;NULL;NULL;NULL;NULL;NULL;NULL;NULL;NULL;NULL;NULL;NULL;NULL
111;LUURZU LEPOA HEGO-I;1;Dolmen;Quinto Real;A unos 500 m al S de la cumbre de Luurzu. Hoja cartográfica Nº: 91-9;Urkiaga;NULL;623210;4668260;1095;42.1567807424162,-1.50862367194774;domingo, octubre 08, 1972;Francisco Ondarra;"Túmulo de 12,5 m de ? y de 0,8 m de altura, compuesto de piedras y tierra y de dos losas ""in situ"", areniscas y pizarras. La losa nº 1: de 1,6 m de largo y 0,12 m de grueso; orientada a 145º. La losa nº 2: de 1 m de largo y 0,08 m de grueso y 0,22 m de alto; orientada a 30º. Tiene un hoyo central de 4 m de ? con muy poca profundidad.";No se conoce.;Bibliografía: Revista Príncipe de Viana nº 142/143, año 1976.;NULL;Bloc 16: Artesiaga - Quinto Real.;0111_FOT_133_0.jpg;NULL;NULL;NULL;NULL;NULL;NULL;NULL;NULL;NULL;NULL;NULL;NULL;NULL;NULL;NULL;NULL;NULL;NULL;NULL;NULL;NULL;NULL;NULL;NULL;NULL;NULL;NULL;NULL;NULL;NULL;NULL;NULL;NULL;NULL;NULL;NULL;NULL;NULL;NULL;NULL;NULL;NULL;NULL;NULL;NULL;NULL;NULL;NULL;NULL;NULL;NULL;NULL
112;LUURZU LEPOA-II;5;Crómlech;Quinto Real;En el collado de Luurzu. Hoja cartográfica Nº: 91-9;Urkiaga;NULL;622695;4668530;1170;42.1592925095994,-1.51479852321055;NULL;NULL;"De unos 20 testigos de areniscas muy pequeñas, formado un circunferencia de 9 m de ?. La piedra nº 1: de 0,92 m de alto; 0,4/0,2 m de ancho y de 0,2/0,3 m de grueso. nº 2: de 1 m de largo. nº 3: de 0,6 m de alto; 0,8 m de largo y 0,3 m de grueso nº 4: de 0,8 m de largo";No se conoce.;Bibliografía: Revista Príncipe de Viana nº 142/143, año 1976.;NULL;Bloc 16: Artesiaga - Quinto Real.;NULL;NULL;NULL;NULL;NULL;NULL;NULL;NULL;NULL;NULL;NULL;NULL;NULL;NULL;NULL;NULL;NULL;NULL;NULL;NULL;NULL;NULL;NULL;NULL;NULL;NULL;NULL;NULL;NULL;NULL;NULL;NULL;NULL;NULL;NULL;NULL;NULL;NULL;NULL;NULL;NULL;NULL;NULL;NULL;NULL;NULL;NULL;NULL;NULL;NULL;NULL;NULL;NULL
113;ARGINTZU LUURZU;2;Túmulo;Quinto Real - Irurita;En el collado entre Luurzu y Argintzo Hoja cartográfica Nº: 91-9;Urkiaga;NULL;623480;4668780;1138;42.1614199585976,-1.50524637137487;jueves, mayo 11, 1905;Tomás López Sellés;Túmulo circular de 11 m de ? y 1 m de altura, de piedras calizas del terreno. Ligero cráter central sin piedras ni losas de cámara. Solo se ve una piedra a pocos metos al S. A 20m al S existen dos crómlech.;No se conoce;Catalogado en MUNIBE con el nº 71-14, suplemento nº 1, año 1973.;NULL;Bloc 16: Artesiaga - Quinto Real.;0113_DIB_134_0.jpg;NULL;NULL;NULL;NULL;NULL;NULL;NULL;NULL;NULL;NULL;NULL;NULL;NULL;NULL;NULL;NULL;NULL;NULL;NULL;NULL;NULL;NULL;NULL;NULL;NULL;NULL;NULL;NULL;NULL;NULL;NULL;NULL;NULL;NULL;NULL;NULL;NULL;NULL;NULL;NULL;NULL;NULL;NULL;NULL;NULL;NULL;NULL;NULL;NULL;NULL;NULL;NULL
114;ARGINTZU-AITZ ZABALTOKI;13;Monolito;Quinto Real;Entre el túmulo y el crómlech Argintzu-I Hoja cartográfica Nº: 91-9;Urkiaga;NULL;623460;4668860;1140;42.1621433796601,-1.50547144228402;sábado, marzo 24, 1973;Francisco Ondarra;"De 3,65 m de largo; 0,5/1,25 m de ancho; orientado a 10º; tendido sobre el suelo; piedra arenisca.";NULL;Bibliografía: - Revista Príncipe de Viana nº 142/143, año 1976 - MUNIBE nº 35, año 1983;NULL;Bloc 16: Artesiaga - Quinto Real.;0114_DIB_135_0.jpg;0114_DIB_135_1.jpg;0114_FOT_136_2.jpg;0114_FOT_136_3.jpg;0114_FOT_136_4.jpg;0114_FOT_136_5.jpg;0114_FOT_136_6.jpg;0114_FOT_136_7.jpg;NULL;NULL;NULL;NULL;NULL;NULL;NULL;NULL;NULL;NULL;NULL;NULL;NULL;NULL;NULL;NULL;NULL;NULL;NULL;NULL;NULL;NULL;NULL;NULL;NULL;NULL;NULL;NULL;NULL;NULL;NULL;NULL;NULL;NULL;NULL;NULL;NULL;NULL;NULL;NULL;NULL;NULL;NULL;NULL;NULL
115;ARGINTZUKO LEPOA;5;Crómlech (3);El I y II en Quinto Real y el III en el Baztan;En el collado entre Argintzu al NE y Luurzu al SW. Hoja cartográfica Nº: 91-9;Urkiaga;NULL;623485;4668820;1138;42.1617793037908,-1.50517738659227;sábado, marzo 24, 1973;Francisco Ondarra;"Nº I: a 15m al SE del túmulo, formado por 16 testigos de piedra arenisca que forman un círculo de 5 m de ?; medidas de las piedras. - nº 1: 1,5 m de alto; 0,5 m de ancho y 0,2 m de grueso; muy inclinada hacia el S. - nº 2: 0,9 m de largo, tendida y casi sepultada - nº 3: 0,9 m de alto - nº 4: 0,8 m de largo - nº 5: 0,8 m de largo y 0,8 m de ancho y casi oculta Nº II: a 45 m al NE del túmulo, formado por 30 testigos de piedras arenicas pequeñas que forman un círculo de 3,5 m de ?; en su interior existe un concavidad. La piedra nº 1 está sepultada en parte y mide 1,35 m de largo; la piedra nº 2 tiene 0,9 m de largo y la nº 3 tiene 0,85 m de largo. Nº III: a 30 m al W del túmulo en término de Baztan, tiene 10 testigos de piedras areniscas que forman un círculo de 6 m de ?, cóncavo en su interior con la mitad de los testigos dispuestos radialmente. El nº 1 mide 0,55 m de largo; el nº 2 mide 0,35 m y otra tumbada en el centro de 0,9 x 0,6 x 0,15 m.";No se conoce;Bibliografía: Revista Príncipe de Viana nº 142/143, año 1976.;NULL;Bloc 16: Artesiaga - Quinto Real.;0115_FOT_137_0.jpg;0115_FOT_137_1.jpg;0115_FOT_137_2.jpg;0115_FOT_137_3.jpg;0115_FOT_137_4.jpg;0115_FOT_137_5.jpg;0115_FOT_137_6.jpg;NULL;NULL;NULL;NULL;NULL;NULL;NULL;NULL;NULL;NULL;NULL;NULL;NULL;NULL;NULL;NULL;NULL;NULL;NULL;NULL;NULL;NULL;NULL;NULL;NULL;NULL;NULL;NULL;NULL;NULL;NULL;NULL;NULL;NULL;NULL;NULL;NULL;NULL;NULL;NULL;NULL;NULL;NULL;NULL;NULL;NULL
116;ARGINTZU SOLTALDEA;5;Crómlech;Quinto Real;Situado en el cabezo, estribación de Argintzu. Hoja cartográfica Nº: 91-9;Urkiaga;NULL;624000;4668700;1122;42.1606175197493,-1.49897076731437;sábado, noviembre 03, 1973;Francisco Ondarra;"Unos 30 testigos de piedra, la mayoría de pizarras, menos los marcados en el croquis con los números 1, 14 y 21 que son de arenisca y el 18 que es de cuarzo blanco. Forman un círculo de 6 m de ?. Las piedras más altas miden 0,3 y 0,25 m; la nº 11, que está tendida, mide 0,7 m de largo, 0,7 m de ancho y 0,05 m de grueso.";No se conoce.;Bibliografía: Revista Príncipe de Viana nº 142/143, año 1976.;NULL;Bloc 16: Artesiaga - Quinto Real.;0116_DIB_138_0.jpg;NULL;NULL;NULL;NULL;NULL;NULL;NULL;NULL;NULL;NULL;NULL;NULL;NULL;NULL;NULL;NULL;NULL;NULL;NULL;NULL;NULL;NULL;NULL;NULL;NULL;NULL;NULL;NULL;NULL;NULL;NULL;NULL;NULL;NULL;NULL;NULL;NULL;NULL;NULL;NULL;NULL;NULL;NULL;NULL;NULL;NULL;NULL;NULL;NULL;NULL;NULL;NULL
117;ANTZABAL;1;Dolmen;Irurita;Irurita Hoja cartográfica Nº: 91-9;Irurita;NULL;622600;4670580;670;42.1777643057292,-1.5155165417816;lunes, noviembre 01, 1982;Francisco Ondarra;"Túmulo de unos 6 m de ? y 0,4 m de altura por el lado W, pero desapareciendo por el lado S; de tierra y piedras con 6 losas de arenisca que miden: - nº 1 (N): 0,4 m de alto; 1,45 m de largo; 0,16 m de grueso - nº 2 (N): 0,1 m 0,45 m 0,1 m - nº 3 (E): 0,3 m 0,65 m 0,13 m - nº 4 (W): 0,35 m 0,8 m 0,1/0,17 m - nº 5 (W): 0,5 m 1 m 0,1, 0,17 m - nº 6 ¿cubierta?: 0,75 m de ancho; 2,42 m de largo y 0,25 m de grueso. Las losas 1, 2, 4 y 5 están clavadas verticalmente. Las losas 1, 4 y 5 han sido parcialmente destruídas, rebajando su altura. La losa 3 está clavada e inclinada hacia el exterior. La losa 6 está partida en 2 trozos y el trozo W mide 0,8 m de largo y está tumbdo sobre la losa 5. Existen más trozos de losas. La cámara podría medir 1 m de ancho y unos 2 m de largo; orientada 105º. Hay un haya en el estremo W.";No se conoce.;Bibliografía: Revista Arqueología nº 7, editada por el Gobierno de Navarra en el año 1988.;NULL;Bloc 16: Artesiaga - Quinto Real.;0117_DIB_139_0.jpg;NULL;NULL;NULL;NULL;NULL;NULL;NULL;NULL;NULL;NULL;NULL;NULL;NULL;NULL;NULL;NULL;NULL;NULL;NULL;NULL;NULL;NULL;NULL;NULL;NULL;NULL;NULL;NULL;NULL;NULL;NULL;NULL;NULL;NULL;NULL;NULL;NULL;NULL;NULL;NULL;NULL;NULL;NULL;NULL;NULL;NULL;NULL;NULL;NULL;NULL;NULL;NULL
118;AUTRIN;1;Dolmen;Baztan;En lo alto de la cota 976 m. Hoja cartográfica Nº: 91-9;Urkiaga;NULL;624390;4670000;976;42.1722599402096,-1.49397372369137;viernes, diciembre 28, 1973;Francisco Ondarra;"Túmulo poco definido con una losa de 1,5 m de alto, de 1,10 m de largo y 0,2 m de grueso que es posiblemente de la cabecera y con dos losas fragmentadas, posiblemente las del N.: nº 2 de 0,2 m de alto , 0,33 m de largo y 0,1 m de grueso; nº 3 de 0,16 m de alto, 0,7 m de largo y 0,11 m de grueso. Orientación a 110º. Areniscas del terreno.";No se conoce.;Bibliografía: Revista Príncipe de Viana nº 142/143, año 1976.;NULL;Bloc 16: Artesiaga - Quinto Real.;0118_DIB_140_0.jpg;0118_FOT_141_1.jpg;NULL;NULL;NULL;NULL;NULL;NULL;NULL;NULL;NULL;NULL;NULL;NULL;NULL;NULL;NULL;NULL;NULL;NULL;NULL;NULL;NULL;NULL;NULL;NULL;NULL;NULL;NULL;NULL;NULL;NULL;NULL;NULL;NULL;NULL;NULL;NULL;NULL;NULL;NULL;NULL;NULL;NULL;NULL;NULL;NULL;NULL;NULL;NULL;NULL;NULL;NULL
119;AZALDEGIKO LEPOA-I;1;Dolmen;Baztan;A 50 m al NE del crómlech, al S de la cima de Autrin. Hoja cartográfica Nº: 91-9;Urkiaga;NULL;624370;4669810;950;42.1705524948061,-1.49425637062201;miércoles, marzo 28, 1973;Tomás López Sellés;"Túmulo de 12/13 m de ? con 2 losas plantadas y otra tendida horizontalmente. Areniscas del terreno. Las medidas de las losas son: - nº 1: 0,25 m de altura; 0,8 m de largo y 0,12 m de grueso - nº 2: 1m "" 0,45 m "" 0,2 m "" . Oreintada a 85º. - nº 3 tendida: 1,5 m de ancho; 1,7 m de largo y 0,15 m de grueso";No se conoce.;Bibliografía: Revista Príncipe de Viana nº 142/143, año 1976.;NULL;Bloc 16: Artesiaga - Quinto Real.;NULL;NULL;NULL;NULL;NULL;NULL;NULL;NULL;NULL;NULL;NULL;NULL;NULL;NULL;NULL;NULL;NULL;NULL;NULL;NULL;NULL;NULL;NULL;NULL;NULL;NULL;NULL;NULL;NULL;NULL;NULL;NULL;NULL;NULL;NULL;NULL;NULL;NULL;NULL;NULL;NULL;NULL;NULL;NULL;NULL;NULL;NULL;NULL;NULL;NULL;NULL;NULL;NULL
120;AZALDEGIKO LEPOA-II;5;Crómlech;Baztan;Al S de la cima de Autrin. Hoja cartográfica Nº: 91-9;Urkiaga;NULL;624350;4670000;950;42.1722662958292,-1.49445785349117;viernes, diciembre 28, 1973;Francico Ondarra;"4 Testigos constituyen un círculo de 5 m de ?. Son de areniscas del terreno. La piedra nº 1, que es la mayor, mide 0,9 m de alto; 0,3 m de largo y 0,25 m de grueso. Las piedras nº 3 y nº 4 miden 0,3 m de alto y 0,5 m de largo. La nº 4 está completamente enterrada.";No se conoce.;Bibliografía: Revista Príncipe de Viana nº 142/143, año 1976.;NULL;Bloc 16: Artesiaga - Quinto Real.;NULL;NULL;NULL;NULL;NULL;NULL;NULL;NULL;NULL;NULL;NULL;NULL;NULL;NULL;NULL;NULL;NULL;NULL;NULL;NULL;NULL;NULL;NULL;NULL;NULL;NULL;NULL;NULL;NULL;NULL;NULL;NULL;NULL;NULL;NULL;NULL;NULL;NULL;NULL;NULL;NULL;NULL;NULL;NULL;NULL;NULL;NULL;NULL;NULL;NULL;NULL;NULL;NULL
121;EZKIREGI;7;Dolmen corto abierto;Ardaiz;En la loma de su nombre, junto y a la derecha de la carretera. Hoja cartográfica Nº: 116-9;Valle del Arriasgoiti;Valle del Arriasgoiti#0121_TEX_143.pdf#;625503;4750400;695;42.8958926174468,-1.46285021211537;lunes, abril 17, 1905;José Miguel de Barandiaran;Túmulo desfigurado. 2 Losas y una cubierta fragmentada. Calizas del terreno. Según el croquis y los datos que figuran en Munibe cuando fue localizado, el monumento tenía cámara formada por tres losas con recinto rectangular en su origen. Hoy casi triangular, cubierta desplazada y rota en dos fragmentos apoyados en el túmulo, que tiene es su cara superior un surco artificial, que partiendo de un punto que dista 0,5 m del borde occidental y formando un zig-zag, va a desembocar en el borde oriental. En la acualidad (26-9-1987), la losa de cámara N está fraccionada en unos ocho trozos desparramados por la cámara. Al desconocer las medidas que puedo tener el túmulo en la fecha de localización, no se puede hacer una comparación de conservación. Sí se puede decir que en su parte S. hay un allanamiento del terreno, si no muy reciente, sí posterior a la fecha de su localización. En cuanto al resto de materiales, no parece que hayan sufrido modificación intencionada, como parece que le ha ocurrido a la losa mencionada.;De la cámara, en 1934 por José Miguel de Barandiaran.;"Ajuar de la excavación: - 2 Hojas, una con retoque de uso, 1 lasca - 1 frag. De borde y cuello de cerámica inidentificable. Según J.M. de Barandiaran, existieron 5 útiles de silex fig. 1, 2, 3 y 5. Museo Arqueológico de Álava. Vitoria. Bibliografía: Barandiaran, JM: Huellas de Arte (1935).375 "" : Catalogue des stations (1946) "" : Hombre Prehistórico… (1953) "" : Notas… (1963-64) Pág. 119 Fernández Medrano, D.:Guía Sumaria… (1948)";NULL;Bloc 17: Erro - Valcarlos - Arriasgoiti;0121_DIB_142_0.jpg;0121_DIB_147_1.jpg;0121_DIB_147_2.jpg;0121_DIB_147_3.jpg;0121_FOT_146_4.jpg;0121_FOT_146_5.jpg;0121_FOT_146_6.jpg;0121_FOT_146_7.jpg;0121_FOT_146_8.jpg;0121_TEX_143_9.jpg;0121_TEX_143_10.jpg;0121_TEX_144_11.jpg;0121_TEX_145_12.jpg;0121_TEX_145_13.jpg;0121_TEX_145_14.jpg;0121_TEX_145_15.jpg;0121_TEX_145_16.jpg;NULL;NULL;NULL;NULL;NULL;NULL;NULL;NULL;NULL;NULL;NULL;NULL;NULL;NULL;NULL;NULL;NULL;NULL;NULL;NULL;NULL;NULL;NULL;NULL;NULL;NULL;NULL;NULL;NULL;NULL;NULL;NULL;NULL;NULL;NULL;NULL
122;ARDAIZ - I;9;Dolmen largo abierto;Ardaiz;Al NE. del pueblo, en el monte Argitxoain, en el término Orgal. Hoja cartográfica Nº: 116-9;Valle del Arriasgoiti;Valle del Arriasgoiti#0121_TEX_143.pdf#;627150;4751075;945;42.9016963254682,-1.44253217442052;lunes, abril 17, 1905;José Miguel de Barandiaran;Túmulo desfigurado de unos 20 m de ?. 5 Losas y una tendida. Calizas del terreno. Sobre un túmulo desfigurado de piedras, cubierto totalmente de bojes, se encuentran cinco losas más una tendida que parecen formar un recinto rectangular muy desfigurado. Cámara totalmente vaciada. Orientación a 110º.;No se conoce.;"Los bojes que cubren el túmulo esconden el conjunto, impidiendo verlo. Aunque no se conoce excavación, se observa que a través del tiempo este monumento ha sufrido violaciones en busca del consabido tesoro. Con fecha 26-9-1987 se le colaca un hito señalizador, actividad de los socios de Gorosti. Bibliografía: Barandiaran, JM: Huellas de Arte (1935).375 "" : Catalogue des stations (1946) "" : Hombre Prehistórico… (1953) Fernández Medrano, D.:Guía Sumaria… (1948)";NULL;Bloc 17: Erro - Valcarlos - Arriasgoiti;0122_DIB_148_0.jpg;0122_FOT_149_1.jpg;0122_FOT_149_2.jpg;NULL;NULL;NULL;NULL;NULL;NULL;NULL;NULL;NULL;NULL;NULL;NULL;NULL;NULL;NULL;NULL;NULL;NULL;NULL;NULL;NULL;NULL;NULL;NULL;NULL;NULL;NULL;NULL;NULL;NULL;NULL;NULL;NULL;NULL;NULL;NULL;NULL;NULL;NULL;NULL;NULL;NULL;NULL;NULL;NULL;NULL;NULL;NULL;NULL;NULL
123;ARDAIZ - II;7;Dolmen corto abierto;Ardaiz;Al NE del pueblo, monte Argitxoain, término Orgal, a 100 m al E. del Ardaiz-I Hoja cartográfica Nº: 116-9;Valle del Arriasgoiti;Valle del Arriasgoiti#0121_TEX_143.pdf#;627000;4751100;945;42.9019463514216,-1.44436321196557;lunes, abril 17, 1905;Por José Miguel de Barandiaran;Túmulo de piedras de 19 m de ?. Calizas del terreno. 3 Losas formando recinto y una de cubierta. Recinto trapezoidal al cerrarse las paredes a la entrada. Losas basculadas por presión de la cubierta. Orientación a 130º. Túmulo casi tapado por los bojes.;No se conoce.;"Al igual que el Ardaiz-I, con fecha 26-9-1987 se fue colocado un hito señalizador por el grupo Gorosti. Bibliografía: Barandiaran, JM: Huellas de Arte (1935).375 "" : Catalogue des stations (1946) "" : Hombre Prehistórico… (1953) Fernández Medrano, D.:Guía Sumaria… (1948)";NULL;Bloc 17: Erro - Valcarlos - Arriasgoiti;0123_DIB_151_0.jpg;0123_DIB_151_1.jpg;0123_DIB_151_2.jpg;0123_DIB_151_3.jpg;0123_DIB_151_4.jpg;0123_DIB_151_5.jpg;0123_DIB_151_6.jpg;0123_DIB_151_7.jpg;0123_DIB_151_8.jpg;0123_DIB_151_9.jpg;0123_DIB_151_10.jpg;0123_DIB_151_11.jpg;0123_DIB_151_12.jpg;0123_DIB_151_13.jpg;0123_FOT_150_14.jpg;0123_FOT_150_15.jpg;0123_FOT_150_16.jpg;0123_FOT_150_17.jpg;0123_FOT_150_18.jpg;NULL;NULL;NULL;NULL;NULL;NULL;NULL;NULL;NULL;NULL;NULL;NULL;NULL;NULL;NULL;NULL;NULL;NULL;NULL;NULL;NULL;NULL;NULL;NULL;NULL;NULL;NULL;NULL;NULL;NULL;NULL;NULL;NULL;NULL
124;OIARZABAL IPAR (BIORRETA - I);7;Dolmen corto abierto;Ardaiz - Zunzarren;En la cresta divisoria de Biorreta - Ardaiz, prolongación monte Etarte. Hoja cartográfica Nº: 116-9;Valle del Arriasgoiti;Valle del Arriasgoiti#0121_TEX_143.pdf#;627500;4748750;970;42.8807084837374,-1.4387746571971;sábado, mayo 06, 1905;Tomás López Sellés;Túmulo de 10 m de ? y 0,45 m de alto. Calizas del terreno. 3 Losas y cubierta desplazada. Túmulo rebajado y recinto de la cámara rectangular. Orientación E.;No se conoce;"Pendiente de colacar hito señalizador. En el mes de marzo de 1988 se recopilan nuevos topónimos de la zona donde se ubica el dolmen. Esta cota se denomina Oiarzalmendi, antes Aska. Desde el monumento, en la prolongación W, al SW se divisa Elomendi; al S., Peña Izaga; al N., Asi. Bibliografía: López Sellés, Tomás: Nuevos dólmenes… 1956 nº 3. "" : Nuevos hallazgos… 1960. 246";NULL;Bloc 17: Erro - Valcarlos - Arriasgoiti;0124_FOT_152_0.jpg;0124_FOT_152_1.jpg;0124_FOT_152_2.jpg;0124_FOT_152_3.jpg;0124_FOT_152_4.jpg;0124_FOT_152_5.jpg;0124_FOT_152_6.jpg;0124_FOT_152_7.jpg;0124_FOT_152_8.jpg;0124_FOT_152_9.jpg;0124_FOT_152_10.jpg;0124_FOT_152_11.jpg;0124_FOT_152_12.jpg;0124_FOT_152_13.jpg;0124_FOT_152_14.jpg;NULL;NULL;NULL;NULL;NULL;NULL;NULL;NULL;NULL;NULL;NULL;NULL;NULL;NULL;NULL;NULL;NULL;NULL;NULL;NULL;NULL;NULL;NULL;NULL;NULL;NULL;NULL;NULL;NULL;NULL;NULL;NULL;NULL;NULL;NULL;NULL;NULL;NULL
